{
  "schemaVersion": "1.0",
  "generatedAt": "2026-05-21T11:30:00Z",
  "company": {
    "slug": "hitachi-energy-india",
    "name": "Hitachi Energy India Ltd",
    "bseScripCode": "543187",
    "nseSymbol": "POWERINDIA",
    "isin": "INE07Y701011"
  },
  "classification": {
    "primaryBucket": "hvdc-facts-grid-stability-oem",
    "secondaryBuckets": ["transformer-manufacturer"],
    "oneLiner": "Hitachi Energy India is primarily an HVDC and grid-stability OEM — India's dominant high-voltage DC technology supplier — with substantial secondary exposure as an EHV/UHV transformer, high-voltage-products and grid-automation manufacturer."
  },
  "companyMapping": [
    {
      "item": "Business segment",
      "analysis": "Reports a single operating segment ('products, projects and services for electricity transmission'). Operated through five business units: Grid Automation, Grid Integration, Transformers, High-Voltage Products, and a Service unit added 1 April 2025.",
      "facts": [
        { "label": "FY25 order mix by offering", "value": "Products 52% / Projects 45% / Services 3%", "period": "FY2024-25", "basis": "actual", "sourceType": "Fact — Company", "sourceRef": "FY2024-25 Annual Report, MD&A order break-up" }
      ]
    },
    {
      "item": "T&D bucket",
      "analysis": "Primary: HVDC / FACTS / grid-stability OEM. Secondary: transformer manufacturer (EHV/UHV). Sits in the highest-value, highest-barrier layer of the T&D value chain; also carries grid-automation and high-voltage-products exposure.",
      "facts": []
    },
    {
      "item": "Product / service",
      "analysis": "HVDC (converter transformers, valves, MACH control; LCC 'HVDC Classic' and VSC 'HVDC Light'), FACTS/STATCOM and power quality, EHV/UHV transformers (765 kV; a 1,200 kV transformer demonstrated historically), high-voltage products including SF6-free 'EconiQ' GIS, grid automation/SCADA, and remote-monitoring service.",
      "facts": []
    },
    {
      "item": "Customer type",
      "analysis": "Utilities are the top sector — POWERGRID/PGCIL and state transcos; private utilities (Adani Electricity Mumbai is >10% of total revenue); industrials, data centres, railways/metros; and exports (27% of FY25 revenue, partly intra-group to Hitachi Energy USA and Sweden).",
      "facts": [
        { "label": "Largest customer", "value": "Adani Electricity Mumbai Infra Ltd >10% of total revenue", "period": "FY2024-25", "basis": "actual", "sourceType": "Fact — Company", "sourceRef": "FY2024-25 Annual Report, Note 37(iii)" }
      ]
    },
    {
      "item": "Revenue / order book exposure",
      "analysis": "FY25 revenue ₹6,385 cr; FY25 order intake ₹18,174 cr (+228% YoY); closing backlog ₹19,246 cr, grown to a record ₹29,872 cr by Q3 FY26 — roughly 3.7x trailing revenue. No segment, voltage-class or HVDC-vs-rest split is disclosed.",
      "facts": []
    },
    {
      "item": "Margin profile",
      "analysis": "Operating EBITDA margin has recovered sharply: ~3.9% (FY23) to 6.7% (FY24) to 9.2% (FY25), with Q3 FY26 reported at ~15.6%. Single-segment reporting means no segment-level margin visibility.",
      "facts": []
    },
    {
      "item": "Key moat",
      "analysis": "Scarce HVDC technology and execution capability — Hitachi Energy powers 9 of 17 HVDC links in India; access to Hitachi Energy parent IP and global installed base; POWERGRID/NTPC vendor approvals; and a multi-decade installed base creating service pull. HVDC and UHV are genuine high-barrier niches.",
      "facts": []
    },
    {
      "item": "Main risk",
      "analysis": "Valuation (P/E ~130x+); sustainability of margins after a roughly 4x recovery; dependence on parent intellectual property (royalty/technology fees ~4% of revenue); and single-segment disclosure that limits independent diligence of order-book and margin quality.",
      "facts": []
    }
  ],
  "sections": {
    "valueChainMap": {
      "summary": "Hitachi Energy India sits at the high-voltage, technology-intensive end of the Power T&D chain — the grid layer that moves bulk power and stabilises it, not the commodity end. Its core is HVDC (bulk long-distance and renewable-evacuation transmission), reinforced by FACTS/grid-stability equipment, EHV/UHV transformers, high-voltage products/GIS, grid automation and power quality. It does not play in towers, conductors, cables, distribution/DISCOM, civil EPC or metering.",
      "points": [
        "Core: HVDC converter stations and power electronics — the scarcest, highest-barrier T&D niche.",
        "Adjacent strength: FACTS/STATCOM, shunt reactors and power quality — grid-stability equipment whose demand rises with renewable penetration.",
        "Manufacturing: EHV/UHV transformers (up to 765 kV) and high-voltage products including SF6-free GIS.",
        "Digital layer: grid automation, SCADA and remote monitoring — a small but growing annuity-style component.",
        "Not exposed to: transmission towers/conductors/cables, distribution utilities, transmission-line civil EPC, or smart metering."
      ],
      "facts": [
        { "label": "Share of India's HVDC links", "value": "9 of 17", "unit": "HVDC links", "period": "FY2024-25", "basis": "actual", "sourceType": "Fact — Company", "sourceRef": "FY2024-25 Annual Report, MD&A" },
        { "label": "Share of India's operational HVDC capacity", "value": "~48%", "unit": "%", "basis": "estimate", "sourceType": "Estimate — Broker", "sourceRef": "IDBI Capital initiation note", "note": "Broker estimate; reconcile against primary disclosure." }
      ]
    },
    "businessModel": {
      "summary": "An OEM-plus-projects-plus-service model: it manufactures and sells high-voltage products, executes turnkey HVDC and substation projects, and is building a service layer (separate business unit from April 2025). It sells predominantly direct to end-users (85% of FY25 orders), with smaller EPC, OEM and distributor channels. It operates 19 manufacturing facilities across 8 locations in 4 cities, and serves as an export/feeder factory for the Hitachi Energy parent network.",
      "points": [
        "Five business units: Grid Automation, Grid Integration, Transformers, High-Voltage Products, Service.",
        "FY25 order channel mix: Direct End-User 85%, EPC 7%, OEM 6%, Distributor 2%.",
        "19 manufacturing facilities across Vadodara, Chennai, Bengaluru and Mysuru.",
        "Listed entity is 71.31% owned by Hitachi Energy Ltd, Zurich (post the March 2025 QIP); ultimate parent Hitachi Ltd, Japan.",
        "India positioned as an export hub — exports were 27% of FY25 revenue, partly intra-group."
      ],
      "facts": [
        { "label": "Manufacturing facilities", "value": 19, "unit": "facilities across 8 locations", "period": "FY2024-25", "basis": "actual", "sourceType": "Fact — Company", "sourceRef": "FY2024-25 Annual Report, About section" },
        { "label": "Promoter (Hitachi Energy Ltd, Zurich) holding", "value": 71.31, "unit": "%", "period": "FY2024-25 (post-QIP)", "basis": "actual", "sourceType": "Fact — Company", "sourceRef": "FY2024-25 Annual Report, Corporate Governance" }
      ]
    },
    "sourceBackedFacts": {
      "summary": "Core company-disclosed figures. Annual-report figures are audited actuals (FY ending March). Q3 FY26 figures are company-reported quarterly results surfaced via secondary financial news and should be reconciled to the primary BSE/NSE filing. FY2021-22 was a 15-month transition period (Jan 2021–Mar 2022) and is not directly comparable.",
      "points": [
        "Revenue and profit have compounded fast, with profit growth far outpacing revenue on operating leverage.",
        "Order intake and backlog have stepped up dramatically since FY24 on large HVDC awards.",
        "The balance sheet is debt-free and net cash, helped by a March 2025 QIP."
      ],
      "facts": [
        { "label": "Revenue from operations", "value": 6384.93, "unit": "INR crore", "period": "FY2024-25", "basis": "actual", "sourceType": "Fact — Company", "sourceRef": "FY2024-25 Annual Report, Statement of P&L" },
        { "label": "Revenue from operations", "value": 5237.49, "unit": "INR crore", "period": "FY2023-24", "basis": "actual", "sourceType": "Fact — Company", "sourceRef": "FY2024-25 Annual Report, comparative" },
        { "label": "Operating EBITDA / margin", "value": "592.3 / 9.2%", "unit": "INR crore / %", "period": "FY2024-25", "basis": "actual", "sourceType": "Fact — Company", "sourceRef": "FY2024-25 Annual Report, Financial Capital" },
        { "label": "Operating EBITDA margin", "value": 6.7, "unit": "%", "period": "FY2023-24", "basis": "actual", "sourceType": "Fact — Company", "sourceRef": "FY2024-25 Annual Report" },
        { "label": "Operating EBITA margin", "value": 3.9, "unit": "%", "period": "FY2022-23", "basis": "actual", "sourceType": "Fact — Company", "sourceRef": "FY2022-23 Annual Report, MD&A", "note": "Cyclical trough — chip shortage, commodity inflation, FX." },
        { "label": "PAT", "value": 383.98, "unit": "INR crore", "period": "FY2024-25", "basis": "actual", "sourceType": "Fact — Company", "sourceRef": "FY2024-25 Annual Report, Statement of P&L", "note": "+134% YoY." },
        { "label": "Order intake", "value": 18173.8, "unit": "INR crore", "period": "FY2024-25", "basis": "actual", "sourceType": "Fact — Company", "sourceRef": "FY2024-25 Annual Report, Directors' Report", "note": "+228% YoY; highest ever." },
        { "label": "Closing order backlog", "value": 19245.9, "unit": "INR crore", "period": "FY2024-25 (as on 31 Mar 2025)", "basis": "actual", "sourceType": "Fact — Company", "sourceRef": "FY2024-25 Annual Report" },
        { "label": "Closing order backlog", "value": 29872, "unit": "INR crore", "period": "Q3 FY26 (as on 31 Dec 2025)", "basis": "actual", "sourceType": "Fact — Company", "sourceRef": "Q3 FY2025-26 results, via financial news", "note": "Record; ~3.7x trailing revenue. Reconcile to primary filing." },